{
  "schema_version": "1.0",
  "batch_id": "batch-956c9f5811c7fc2298686fc300fecb84",
  "packet_id": "packet-11111111111111111111111111111111",
  "packet_digest": "sha256:aaaaaaaaaaaaaaaaaaaaaaaaaaaaaaaaaaaaaaaaaaaaaaaaaaaaaaaaaaaaaaaa",
  "role": "primary",
  "adjudicator": "synthetic-primary",
  "submitted_at": "2026-08-18T12:10:00Z",
  "decisions": [
    {
      "decision_id": "decision-synthetic-one",
      "assignment_id": "assignment-22222222222222222222222222222222",
      "classification": "match",
      "decided_at": "2026-08-18T12:05:00Z",
      "rationale": "Synthetic rationale",
      "supersedes": null,
      "resolves": []
    }
  ],
  "content_digest": "sha256:956c9f5811c7fc2298686fc300fecb8439d85697b84f92726275569c20b51412"
}
